question_cleaned,department_target,message_uid,question_original,department_original,is_short_question
може ли клиент да използва само интернет банкирането dsk online?,Пазар Ежедневно банкиране,578489a5-9c57-4ded-88b7-faf591a73420,Може ли клиент да използва само интернет банкирането DSK Online?,Пазар Ежедневно банкиране,False
"въвеждам номер на лк и получавам грешка: полето е задължително. кое поле? 18:31 иван любомиров иванов над грешката има линк ""декларация за данъчни цели"". ако го натисна, излиза форма с личните ми данни, като само гражданството липсва. избирам го, но не мога да го запазя (""запази"" не прави нищо)",Други,825d43e2-ace6-4236-8e86-700821454232,"въвеждам номер на ЛК и получавам грешка: полето е задължително. Кое поле?

18:31 ИВАН ЛЮБОМИРОВ ИВАНОВ
над грешката има линк ""Декларация за данъчни цели"". Ако го натисна, излиза форма с личните ми данни, като само гражданството липсва. Избирам го, но не мога да го запазя (""Запази"" не прави нищо)",Други,False
служител светослав симов,Други,76bed0ff-1b7d-45f2-8d3d-5f5d9c3a7b3b,Служител Светослав Симов,Други,False
колко е еднократната такса,Други,333b5ef1-c3f2-40ff-81ec-2384515625fa,Колко е еднократната такса,Други,False
има ли такса за отриване на набирателна сметка за през онбординг процес ?,Пазар Малък бизнес,598cbfde-8362-433f-b03e-13cc65eb9d01,Има ли такса за отриване на набирателна сметка за през онбординг процес ?,Пазар Малък бизнес,False
какво включва план за пенсия,Пазар Ежедневно банкиране,cd2b58bd-00a2-4ba1-9253-8e61d04630b7,какво включва план за пенсия,Пазар Ежедневно банкиране,False
до колко време се обработват преводите rings,Пазар Ежедневно банкиране,3de2bda3-e74c-4603-9129-697b273bc4f1,До колко време се обработват преводите  rings,Пазар Ежедневно банкиране,False
номер за контакт на клона батемберф софия за клиенти,Други,fba9b154-cf2d-41bb-964f-3543a99f5440,номер за контакт на клона Батемберф софия за клиенти,Други,False
през дск мобайл може ли да се блокират картите от титуляра им?,Пазар Ежедневно банкиране,b1cf7bcf-c0a2-46e1-909c-27db08d6bd9c,През ДСК МОБАЙЛ може ли да се блокират картите от титуляра им?,Пазар Ежедневно банкиране,False
какви съобщения са получили клиентите през месец март за промени в оу,Други,f0b1c809-30c5-49b4-a99a-509e98b47a68,Какви съобщения са получили клиентите през месец март за промени в оу,Други,False
колко струва превод към бюджета нареден от фирмена сметка,ДИРЕКЦИЯ БАНКОВИ ОПЕРАЦИИ,73aaad70-2197-4ebe-8ec3-a31cefd003fd,колко струва превод към бюджета нареден от фирмена сметка,ДИРЕКЦИЯ БАНКОВИ ОПЕРАЦИИ,False
"знаеш ли какво означават следните съкращения: кк, од, ктп?",Няколко пазара,1993f6f5-1dab-4061-abd2-5cf40ab2cff2,"Знаеш ли какво означават следните съкращения: КК, ОД, КТП?",Няколко пазара,False
изплащане на наследствен дял,Support_Services,7a2eede5-c719-4b4c-9da3-9252349847c2,изплащане на наследствен дял ,ПРАВНО,False
с доход 1300 лв. може ли клинта да получи кредит 60000,Пазар Потребителско кредитиране,6494a98a-c937-40f9-b3f4-ae964a109b6d,с доход 1300 лв. може ли клинта да получи кредит 60000,Пазар Потребителско кредитиране,False
какъв е минималния лимит по кк,Пазар Разсрочени плащания,b3fa0e0f-fc11-47e1-b8cb-f07e6b5411f6,какъв е минималния лимит по кк,Пазар Разсрочени плащания,False
със заплата 2700 лева какъв максимален лимит на потребителски кредит мога да изтегля?,Пазар Потребителско кредитиране,822dd627-9859-404a-a4ad-ed8d34aa7a18,със заплата 2700 лева какъв максимален лимит на потребителски кредит мога да изтегля?,Пазар Потребителско кредитиране,False
каква е таксата за реактивиране на ограничена сметка,Пазар Ежедневно банкиране,0d985efd-138f-40a3-aef6-dbf3f5b45423,каква е таксата за реактивиране на ограничена сметка,Пазар Ежедневно банкиране,False
теглене в брой от етажна собственост,ДИРЕКЦИЯ ПАЗАР АТМ И КАСОВА ДЕЙНОСТ,2dd3be38-bc54-4bab-83b1-787ddaa47324,теглене в брой от етажна собственост,ДИРЕКЦИЯ ПАЗАР АТМ И КАСОВА ДЕЙНОСТ,False
"когато клиент иска да потвърди плащане ползвайки дск онлайн,как ще го направи?",Пазар Ежедневно банкиране,f4cf52c9-1653-48f8-9bfb-4a8678dab87e,"когато клиент иска да потвърди плащане ползвайки дск онлайн,как ще го направи?",Пазар Ежедневно банкиране,False
здравей. помагаш ли с математически задачи? например колко е 2+2?,Други,b21ac5c5-8030-4fd4-b9c4-872800e63ec8,Здравей. помагаш ли с математически задачи? например колко е 2+2?,Други,False
планове за юридически лица,Пазар Малък бизнес,d00d057c-b750-4acd-a738-941de717c01f,планове за юридически лица,Пазар Малък бизнес,False
има ли възможност за млади семейства и облекчения по тях ?,Пазар Жилищни и ипотечни кредити,25f35fec-415c-4d29-85db-b198441fbcf5,Има ли възможност за млади семейства и облекчения по тях ? ,Пазар Жилищни и ипотечни кредити,False
в момента има ли преференций за дск макс които бяха в промоция,Пазар Ежедневно банкиране,2856304a-d063-4f79-9bf3-f3187a19e3be,В МОМЕНТА ИМА ЛИ ПРЕФЕРЕНЦИЙ ЗА ДСК МАКС КОИТО БЯХА В ПРОМОЦИЯ,Пазар Ежедневно банкиране,False
какви са таксите за ипотечен кредит в размер на 7000000 лева,Пазар Жилищни и ипотечни кредити,69e23dc3-2907-4032-b914-115e06144224,какви са таксите за ипотечен кредит в размер на 7000000 лева,Пазар Жилищни и ипотечни кредити,False
"кой от изброените фондове на дск управление на активи ад, дистрибутирани от банка дск, инвестира на регулирани пазари в българия и чужбина?",Пазар Спестяване и инвестиции,9c7f6722-2aae-45ad-a6a0-bf5b9d58883b,"Кой от изброените фондове на ДСК Управление на активи АД, дистрибутирани от Банка ДСК, инвестира на регулирани пазари в България и чужбина?",Пазар Спестяване и инвестиции,False
допускаме ли отклонение за кредитиране в изпитатален срок,Няколко пазара,821c41f1-c587-4952-aeb3-39b93baeae55,допускаме ли отклонение за кредитиране в изпитатален срок,Няколко пазара,False
какъв е срока за отговор при оспорване на транзакция?,Други,ec707fdc-b6a1-4d8b-8ceb-d641fd884fb2,какъв е срока за отговор при оспорване на транзакция?,Други,False
пълномощно предоставено в банката преди 2016г. може ли да се приеме зао валидно след новите условия,Support_Services,731bd928-cc6f-47c0-9d59-aa9b3e4bba4b,Пълномощно предоставено в банката преди 2016г. може ли да се приеме зао валидно след новите условия,ПРАВНО,False
"здравейте! имам абонамент за бизнес съобщенията на viber и получавам такива всеки път, когато извърша транзакция с картата си - теглене от банкомат или плащане на пос. има ли как да филтрирам тези съобщения, тъй като всеки ден използвам картата си средно между 3 и 4 пъти за плащане на пос, понякога и повече? имам ли опция да избирам какви съобщения мога да получавам спрямо вида транзакция?",Други,d1c1fceb-4b52-4932-be7e-60242c8ba304,"Здравейте! Имам абонамент за бизнес съобщенията на Viber и получавам такива всеки път, когато извърша транзакция с картата си - теглене от банкомат или плащане на ПОС. Има ли как да филтрирам тези съобщения, тъй като всеки ден използвам картата си средно между 3 и 4 пъти за плащане на ПОС, понякога и повече? Имам ли опция да избирам какви съобщения мога да получавам спрямо вида транзакция? ",Други,False
може ли студент да получи кредитна карта ?,Пазар Разсрочени плащания,91aeeaad-9371-4e2b-9ab4-fe27e4db3f26,Може ли студент да получи кредитна карта ?,Пазар Разсрочени плащания,False
какво представлява инвестиционната стратегия на фонда?,Пазар Спестяване и инвестиции,8a3b0fbd-1721-4922-a5e9-892585550a1f,какво представлява инвестиционната стратегия на фонда?,Пазар Спестяване и инвестиции,False
с колко имена трябва да се регистрира руски гражданин,Пазар Ежедневно банкиране,2f58ed50-52e6-4961-93d8-d00987e84621,С колко имена трябва да се регистрира руски гражданин,Пазар Ежедневно банкиране,False
премиум клиент е,Други,16941a43-d04a-42bf-b8f9-7d67a272d8fd,премиум клиент е,Други,False
къде в srm да видя дали документа за самоличност е валиден,Support_Services,036f29c9-92f1-4c16-b2ed-9185363e2c6b,къде в SRM да видя дали документа за самоличност е валиден,CRM,False
"в офиса в г. оряховица постъпи запитване от клиент за ипотечен кредит с доходи от чужбина. клиентът работи в холандия, набавил си е необходимите документи, българин е по рождение, но има само холандско гражданство, спазвайки разпоредбите на страната. възможно ли е кредитиране?",Пазар Жилищни и ипотечни кредити,8399db1e-eedd-4fc9-8d39-860405147eb2,"В офиса в Г. Оряховица постъпи запитване от клиент за ипотечен кредит с доходи от чужбина. Клиентът работи в Холандия, набавил си е необходимите документи, българин е по рождение, но има само Холандско гражданство, спазвайки разпоредбите на страната. Възможно ли е кредитиране?",Пазар Жилищни и ипотечни кредити,False
упф,Пазар Спестяване и инвестиции,599b1aa5-5e27-4c70-b874-4b4fd951ebda,УПФ,Пазар Спестяване и инвестиции,True
какви са преференциите по премиум план ?,Пазар Ежедневно банкиране,11b81fa9-c9cf-47d8-b432-76632694d242,Какви са преференциите по Премиум план ?,Пазар Ежедневно банкиране,False
колко дебитни карти може да има един клиент,Пазар Ежедневно банкиране,988fc30f-224f-48c9-9a33-37f2e1ba1992,колко дебитни карти може да има един клиент,Пазар Ежедневно банкиране,False
какви са допустимите просрочия за отпускане на кредит,Няколко пазара,6ab7741c-a286-4f6a-b617-e0da62f10233,Какви са допустимите просрочия за отпускане на кредит,Няколко пазара,False
в офис каква ще е таксата?,Пазар Ежедневно банкиране,b2b2a8b7-362b-4451-a7fa-2cd2e2893af5,В ОФИС КАКВА ЩЕ Е ТАКСАТА?,Пазар Ежедневно банкиране,False
по лесно предлагане на инвестиционни планове,Пазар Спестяване и инвестиции,a97a3f25-7bad-4e75-abb0-eef03f131066,по лесно предлагане на инвестиционни планове ,Пазар Спестяване и инвестиции,False
до колко часа се пуска заявка за теглене на пари на каса?,ДИРЕКЦИЯ БАНКОВИ ОПЕРАЦИИ,860e7133-2e94-40a4-b756-3889461d00c3,до колко часа се пуска заявка за теглене на пари на каса?,ДИРЕКЦИЯ БАНКОВИ ОПЕРАЦИИ,False
какъв е процента на финансиране по жилищен кредит ?,Пазар Жилищни и ипотечни кредити,34923d03-549f-4178-b772-08a27e22bb7b,Какъв е процента на финансиране по жилищен кредит ?,Пазар Жилищни и ипотечни кредити,False
"ако клиент иска да си закрие разплащателната сметка, а ползва кредит, може ли да го направи?",Пазар Потребителско кредитиране,c0e80d54-95fe-43f9-abea-12e340749829,"Ако клиент иска да си закрие разплащателната сметка, а ползва кредит, може ли да го направи?",Пазар Потребителско кредитиране,False
кои наследници дължат данък наследство,Пазар Разсрочени плащания,c16a917b-2920-4490-a5b9-eecd18ec4bb5,Кои наследници дължат данък наследство,Пазар Разсрочени плащания,False
има ли гратисен период на кредитна карта dsk maxi card,Пазар Разсрочени плащания,04da95c6-cbee-42ed-a4ea-38a95df4d5c3,Има ли гратисен период на кредитна карта DSK MAXI CARD,Пазар Разсрочени плащания,False
предимства на ипотечен кредит,Пазар Жилищни и ипотечни кредити,463a42ee-c01a-4f6c-8338-af26b5223ff1,ПРЕДИМСТВА НА ИПОТЕЧЕН КРЕДИТ,Пазар Жилищни и ипотечни кредити,False
каква е твоята квалификация?,Други,e6748491-faa5-4593-a7b5-b8d28df3a8d6,каква е твоята квалификация?,Други,False
какви са ползите за клиента от план без ограничения,Пазар Ежедневно банкиране,c5eaa4fd-3a61-4c16-b9cc-4057392a5259,Какви са ползите за клиента от план без ограничения ,Пазар Ежедневно банкиране,False
"закриване на сметка със салдо до 10,00 лева",ДИРЕКЦИЯ БАНКОВИ ОПЕРАЦИИ,170f195f-cefd-45b9-aa47-d051887fc9bd,"Закриване на сметка със салдо до 10,00 лева",ДИРЕКЦИЯ БАНКОВИ ОПЕРАЦИИ,False
колко е месечната такса за план за младежи?,Пазар Ежедневно банкиране,aaa4f509-ea8b-4617-867f-f7a0ea725334,Колко е месечната такса за План за младежи?,Пазар Ежедневно банкиране,False
какво включва пакет пълен?,Пазар Банково застраховане,9493ddae-bdeb-4f24-8985-baf56640c254,какво включва пакет пълен?,Пазар Банково застраховане,False
има ли дистанционен процес за откриване на сметка дск тийн,Пазар Ежедневно банкиране,880e93b2-da7f-4c25-839c-a98fd27516f5,има ли дистанционен процес за откриване на сметка ДСК Тийн,Пазар Ежедневно банкиране,False
до каква сума може да бъде преведена по мобилен номер през приложението,Пазар Ежедневно банкиране,306a3c37-5314-4076-8b53-89820ad15cbe,До каква сума може да бъде преведена по мобилен номер през приложението,Пазар Ежедневно банкиране,False
може ли да ми кажеш къде се намира документ с номер rl_rm_1.16.03.04_app_05,Други,97c032d6-a57e-49c2-9f80-2d9020b78feb,Може ли да ми кажеш къде се намира документ с номер RL_RM_1.16.03.04_App_05,Други,False
какви са необходимити документи за жилищен кредит,Пазар Жилищни и ипотечни кредити,e84303d2-710c-46fc-91fb-bf0dd1e8b2e7,какви са необходимити документи за жилищен кредит,Пазар Жилищни и ипотечни кредити,False
какви документи са необходими за откриване на набирателна сметка,Пазар Малък бизнес,b71057da-15a9-42e3-80ab-4a80ebb453c5,какви документи са необходими за откриване на набирателна сметка,Пазар Малък бизнес,False
коя е падежната дата за погасяване на задължение по кредитна карта,Пазар Разсрочени плащания,cc7f2fb7-630d-4f33-8e1c-c9fcbc1bb0a8,Коя е падежната дата за погасяване на задължение по кредитна карта,Пазар Разсрочени плащания,False
какъв е максималния лимит за теглене на банкомат с карта на банка дск,ДИРЕКЦИЯ ПАЗАР АТМ И КАСОВА ДЕЙНОСТ,e8224f01-c325-4f49-abda-244beb70d2f9,какъв е максималния лимит за теглене на банкомат с карта на банка дск ,ДИРЕКЦИЯ ПАЗАР АТМ И КАСОВА ДЕЙНОСТ,False
как да поискам договорен курс за превод,ДИРЕКЦИЯ БАНКОВИ ОПЕРАЦИИ,63b6a37d-655d-4ad6-91e7-6f5e26d45d1f,КАК ДА ПОИСКАМ ДОГОВОРЕН КУРС ЗА ПРЕВОД,ДИРЕКЦИЯ БАНКОВИ ОПЕРАЦИИ,False
какви условия могат да бъдат предложени на бизнес клиент за ползване на пос терминал,Пазар Малък бизнес,4f3fa695-629f-4205-be3f-4272f65bedc6,Какви условия могат да бъдат предложени на бизнес клиент за ползване на пос терминал,Пазар Малък бизнес,False
кога не се дължи такса за анализ и оценка на обезпечение ?,Пазар Жилищни и ипотечни кредити,45a1b0e9-72c4-40d3-8cf7-fc576fe0e98e,кога не се дължи такса за анализ и оценка на обезпечение ?,Пазар Жилищни и ипотечни кредити,False
колко дебитни карти може да има физическо лице,Пазар Ежедневно банкиране,ff4d3127-8893-4908-8e31-484918fe97f0,колко дебитни карти може да има физическо лице,Пазар Ежедневно банкиране,False
може ли с пълномощно където не е опоменато да се предаде дебитна карта,Support_Services,618095e8-1b49-4993-b8fe-9a5da58fbaac,може ли с пълномощно където не е опоменато да се предаде дебитнА карта,ПРАВНО,False
може ли лице под 18 години да ползва dsk mobile,Пазар Ежедневно банкиране,4387a98a-ebc1-46fb-9dec-aab26eab61e1,може ли лице под 18 години да ползва dsk mobile,Пазар Ежедневно банкиране,False
защо ми е блокирана картата ?,Други,cb07f025-714c-491e-8907-cfbba4106709,Защо ми е блокирана картата ?,Други,False
какви могат да бъдат обезпеченията при ипотечен кредит за гараж ?,Пазар Жилищни и ипотечни кредити,0b46e66e-78c9-465a-9277-744c48d95730,Какви могат да бъдат обезпеченията при ипотечен кредит за гараж ?,Пазар Жилищни и ипотечни кредити,False
каква е процедурата за издаване на удостоверение за липса на задължения?,Няколко пазара,65d3b6d6-c5fb-4a79-b7af-88e2e1bd5218,каква е процедурата за издаване на удостоверение за липса на задължения?,Няколко пазара,False
пекети фирам,Пазар Малък бизнес,e28d39aa-6d1b-45e8-937d-b2a5a1194937,пекети фирам,Пазар Малък бизнес,False
на каква база се определя кой може да изтегли кредит,Няколко пазара,00f79fb5-c059-4e36-84d4-0829e16ebe64,на каква база се определя кой може да изтегли кредит ,Няколко пазара,False
"ако клиент изтегли жилищен кредит и се пенсионира по време на изплащане на кредита, какво трябва да предвидим",Пазар Жилищни и ипотечни кредити,3b986738-6b41-42d8-b5df-887a11988aa0,"Ако клиент изтегли жилищен кредит и се пенсионира по време на изплащане на кредита, какво трябва да предвидим",Пазар Жилищни и ипотечни кредити,False
