question_cleaned,department_target,message_uid,question_original,department_original,is_short_question
бланка за валутен превод,ДИРЕКЦИЯ БАНКОВИ ОПЕРАЦИИ,1c2d9e93-7e40-4bd7-8202-2d3a9df722c0,бланка за валутен превод,ДИРЕКЦИЯ БАНКОВИ ОПЕРАЦИИ,False
заявление за заличаване на ипотека,Пазар Жилищни и ипотечни кредити,83bff6c7-4f34-4458-85e9-73b5d17088d9,заявление за заличаване на ипотека,Пазар Жилищни и ипотечни кредити,False
колко е необходимото време за закриване на наследствен влог,ДИРЕКЦИЯ БАНКОВИ ОПЕРАЦИИ,adcbe196-1674-40d2-9399-7a5a28f8cd6a,Колко е необходимото време за закриване на наследствен влог,ДИРЕКЦИЯ БАНКОВИ ОПЕРАЦИИ,False
има ли такса за предсрочно погасяване на потребителски кредит,Пазар Потребителско кредитиране,cc24766e-b631-4ab2-8b8f-6b18186ac1ae,Има ли такса за предсрочно погасяване на потребителски кредит,Пазар Потребителско кредитиране,False
dsk maxi go дебитна ли е,Пазар Ежедневно банкиране,54853f49-b193-4dc0-8e40-378587d1fe6b,DSk maxi go дебитна ли е,Пазар Ежедневно банкиране,False
план за пенсия,Пазар Ежедневно банкиране,de6d011f-8153-4cdb-ac46-d1aeaf27856f,план за пенсия ,Пазар Ежедневно банкиране,False
каква е таксата за превод към америка,ДИРЕКЦИЯ БАНКОВИ ОПЕРАЦИИ,08cc855d-98dc-447b-8178-414fc8bf479b,каква е таксата за превод към америка,ДИРЕКЦИЯ БАНКОВИ ОПЕРАЦИИ,False
какви са разликите между дск мобайл и дск смарт,Пазар Ежедневно банкиране,9602caf0-0b80-484a-acbd-a7ac1d1b537b,Какви са разликите между дск мобайл и дск смарт,Пазар Ежедневно банкиране,False
"мога ли да изтегля получени дивиденти, ако не съм клиент на банката",Други,3ad3637f-9c1a-412a-b443-0450a7d303d1,"мога ли да изтегля получени  дивиденти, ако не съм клиент на банката",Други,False
ккаво представлява кредитната карта дск wizz air,Пазар Разсрочени плащания,a4ba8b92-0cdb-43ef-92af-43cd19b35450,Ккаво представлява кредитната карта ДСК Wizz Air,Пазар Разсрочени плащания,False
заявка за санитарни консумативи,Други,77f20432-cf20-4f0d-8f82-74f85621e91d,заявка за санитарни консумативи,Други,False
клиент на банка дск с рс има ли такса при вноска и теглене на гише?,ДИРЕКЦИЯ ПАЗАР АТМ И КАСОВА ДЕЙНОСТ,3aa09749-43d9-4c15-a67b-7dae9c065aec,Клиент на банка ДСК с РС има ли такса при вноска и теглене на гише?,ДИРЕКЦИЯ ПАЗАР АТМ И КАСОВА ДЕЙНОСТ,False
анализ на доход от дивиденти,ДИРЕКЦИЯ КРЕДИТЕН РИСК ИНДИВИДУАЛНИ КЛИЕНТИ,638e00d1-6ccf-4019-9c4d-4b5c8632d28c,анализ на доход от дивиденти,ДИРЕКЦИЯ КРЕДИТЕН РИСК ИНДИВИДУАЛНИ КЛИЕНТИ,False
какво е airport security fast track:,Пазар Разсрочени плащания,44422150-6dea-454d-93c1-0fc03551d071,Какво е Airport Security Fast Track:,Пазар Разсрочени плащания,False
кога се прилага буфер и в какъв размер,Няколко пазара,b268a343-fc61-4003-ad58-e1b0d6b4bdd4,кога се прилага буфер и  в какъв размер,Няколко пазара,False
като служител имам ли такса за вноска по лична сметка,Пазар Ежедневно банкиране,98dacf03-f98a-43d7-ab3d-a08c7ca783d1,като служител имам ли такса за вноска по лична сметка,Пазар Ежедневно банкиране,False
трезор,Пазар Ежедневно банкиране,2806152a-1214-413f-b2a0-ebde9616609c,трезор,Пазар Ежедневно банкиране,True
какво включва асистиран процес в офис на банката за регистрация на бизнес клиенти ?,Пазар Малък бизнес,b19a7166-f38c-4bd8-8290-6ea50703084b,какво включва асистиран процес в офис на банката за регистрация на бизнес клиенти ?,Пазар Малък бизнес,False
"клиент е закупил със собствени средства недвижим имот магазин в гр. софия за сумата 155 000евро. клиентът се интересува от ипотечен кредит за възстановяване на средствата за направената покупка, като за обезпечване на кредита предлага своя жилищен имот в гр. софия, представляващ завършен апартамент. мога ли да предложа на клиента целеви ипотечен кредит за възстановяване на средствата от направената покупка 155 000евро - 10% = 139 500евро с достатъчност на обезпечение жилищен им",Пазар Жилищни и ипотечни кредити,511e4938-a9e8-4565-bb97-d0f287e7d3bd,"Клиент е закупил със собствени средства недвижим имот Магазин в гр. София за сумата 155 000евро. Клиентът се интересува от ипотечен кредит за възстановяване на средствата за направената покупка, като за обезпечване на кредита предлага своя жилищен имот в гр. София, представляващ завършен апартамент. Мога ли да предложа на клиента целеви ипотечен кредит за възстановяване на средствата от направената покупка 155 000евро - 10% = 139 500евро с достатъчност на обезпечение жилищен им",Пазар Жилищни и ипотечни кредити,False
"от кога влизат в сила безплатните картови операции вкючени в план без ограничение и план премиум, от следващият работен ден на",Пазар Ежедневно банкиране,3225bf37-328c-4bd0-b666-b04ce907c2f2,"от кога влизат в сила безплатните картови операции вкючени в план без ограничение и план премиум, от следващият работен ден на",Пазар Ежедневно банкиране,False
как се верифицират контактни данни при дигитален онбординг или регистрация в dsk mobile,Пазар Ежедневно банкиране,1ee7380a-a8a9-49ce-8f63-3988304072bc,как се верифицират контактни данни при дигитален онбординг или регистрация в DSK Mobile,Пазар Ежедневно банкиране,False
какви документи банката приема за удостоверяващи икономическа връзка със страната при чуждестнанни граждани,Пазар Ежедневно банкиране,86f8a548-30e0-41d8-92ca-4640b64ce1f2,какви документи банката приема за удостоверяващи икономическа връзка със страната при чуждестнанни граждани ,Пазар Ежедневно банкиране,False
каква е минималната лихва при кк,Пазар Разсрочени плащания,f46d33ce-1a06-4447-b694-2fdf7727ed69,каква е минималната лихва при кк,Пазар Разсрочени плащания,False
каква е цената на план за младежи,Пазар Ежедневно банкиране,9a123fc1-28bd-428d-8ad3-fd05a575f52b,каква е цената на план за младежи,Пазар Ежедневно банкиране,False
за кои валутни преводи през дск мобайл може да се изиска преференциален курс,Пазар Ежедневно банкиране,f7a852c0-25a5-47da-bc13-5772920dc56b,за кои валутни преводи през дск мобайл може да се изиска преференциален курс ,Пазар Ежедневно банкиране,False
на падежна дата може ли да се погасява изцяло кредит ?,Няколко пазара,18838f1f-5b1b-4a60-9f12-3f826a9a9431,На падежна дата може ли да се погасява изцяло кредит ?,Няколко пазара,False
колко е таксата за вноска по бюджетна сметка,Пазар Ежедневно банкиране,554326cd-e95f-4980-aeec-f5c5f119a0bf,КОЛКО Е ТАКСАТА ЗА ВНОСКА ПО БЮДЖЕТНА СМЕТКА ,Пазар Ежедневно банкиране,False
"ще се начислява ли пропорционална годишна такса, при деактивиране на съществуващи кредитни карти mastercard, при миграцията към visa?",Пазар Разсрочени плащания,a7b8760f-cbbe-4000-9d60-7d01fbffe48b,"Ще се начислява ли пропорционална годишна такса, при деактивиране на съществуващи кредитни карти Mastercard, при миграцията към Visa?",Пазар Разсрочени плащания,False
с колко се сконтира доход от граждански договор,ДИРЕКЦИЯ КРЕДИТЕН РИСК ИНДИВИДУАЛНИ КЛИЕНТИ,80d46b43-96cf-46ab-8a4c-1f72c6dc9b28,С колко се сконтира доход от граждански договор,ДИРЕКЦИЯ КРЕДИТЕН РИСК ИНДИВИДУАЛНИ КЛИЕНТИ,False
младежки план,Пазар Ежедневно банкиране,751d27c9-e7e5-4e0b-b6a1-224d90195435,Младежки план,Пазар Ежедневно банкиране,False
как се открива дск старт,Пазар Ежедневно банкиране,5e60faea-0947-49f8-bd5d-2b2312f4aca1,как се открива дск старт,Пазар Ежедневно банкиране,False
колко е лимита за безплатно теглене на каса на премиум клиент?,ДИРЕКЦИЯ БАНКОВИ ОПЕРАЦИИ,7ac45af5-104c-4a19-8df0-4dc6358fc3e7,Колко е лимита за безплатно теглене на каса на премиум клиент?,ДИРЕКЦИЯ БАНКОВИ ОПЕРАЦИИ,False
доходи от майчинство,ДИРЕКЦИЯ КРЕДИТЕН РИСК ИНДИВИДУАЛНИ КЛИЕНТИ,6742b71e-c2fc-46ee-ad90-6d7fd73d6a2d,Доходи от майчинство,ДИРЕКЦИЯ КРЕДИТЕН РИСК ИНДИВИДУАЛНИ КЛИЕНТИ,False
колко е паричната равностойност на 1 уиз еър точка ?,Пазар Разсрочени плащания,d62c4d9d-031b-4c5e-9e94-df7387f49337,Колко е паричната равностойност на 1 Уиз еър точка ?,Пазар Разсрочени плащания,False
даваме ли кредити за покупка на жилища на чуждестрани лица извън ес работещи в българия?,Пазар Жилищни и ипотечни кредити,25849682-1e3a-48d7-8a19-69ae8e9f7b98,Даваме ли кредити за покупка на жилища на чуждестрани лица извън ЕС работещи в България?,Пазар Жилищни и ипотечни кредити,False
а какви преференции ползва с карта world debit mastercard,Пазар Ежедневно банкиране,82fb088c-dfcf-4e73-95dd-f6f68eaf75d4,А какви преференции ползва с карта World debit mastercard,Пазар Ежедневно банкиране,False
как се оперира със замразена сметка,Други,f6699233-663f-4908-9e59-23f88fc37dc4,как се оперира със замразена сметка ,Други,False
какъв е вальора за стандартен валутен превод swift,ДИРЕКЦИЯ БАНКОВИ ОПЕРАЦИИ,e3203880-e73f-40fe-8afb-c5586fd6cb79,какъв е вальора за стандартен валутен превод SWIFT,ДИРЕКЦИЯ БАНКОВИ ОПЕРАЦИИ,False
може ли в табличен вид план за пенсия?,Пазар Ежедневно банкиране,d17e4eca-061d-4f34-814f-43a815d60b79,МОЖЕ ЛИ В ТАБЛИЧЕН ВИД ПЛАН ЗА ПЕНСИЯ?,Пазар Ежедневно банкиране,False
каква е процедурата за закриване на овърдрафт,Пазар Потребителско кредитиране,9e48f092-f6ea-474b-9f81-d98a5846a2c6,каква е процедурата за закриване на овърдрафт,Пазар Потребителско кредитиране,False
с кой видове ипотечни кредити банката дава възможност на клиента да усвои кредита на етапи?,Пазар Жилищни и ипотечни кредити,959082aa-5087-4c6b-8102-07229cb5b9cd,С КОЙ ВИДОВЕ ИПОТЕЧНИ КРЕДИТИ БАНКАТА ДАВА ВЪЗМОЖНОСТ НА КЛИЕНТА ДА УСВОИ КРЕДИТА НА ЕТАПИ?,Пазар Жилищни и ипотечни кредити,False
може ли да се разреши ипотечен кредит с обезпечение къща за гости,Пазар Жилищни и ипотечни кредити,b1127d67-0dcf-46b8-b836-135ea2c1ebd6,може ли да се разреши ипотечен кредит с обезпечение къща за гости,Пазар Жилищни и ипотечни кредити,False
може ли на атм да се внася евро?,ДИРЕКЦИЯ ПАЗАР АТМ И КАСОВА ДЕЙНОСТ,ae78414a-7e97-4d10-ae1c-0ca14007e51d,Може ли на АТМ да се внася евро?,ДИРЕКЦИЯ ПАЗАР АТМ И КАСОВА ДЕЙНОСТ,False
искане за жилищен кредит от собственик на фирма и земеделски производител как да изчисля доход за анализ,Пазар Жилищни и ипотечни кредити,8af558c3-2816-4f7b-b486-3b39bf432124,искане за жилищен кредит от собственик на фирма и земеделски производител как да изчисля доход за анализ ,Пазар Жилищни и ипотечни кредити,False
имам проблем с активиране на дск мобайл,Пазар Ежедневно банкиране,ade9ba62-a705-4c8b-8c20-808111da4b17,Имам проблем с активиране на дск мобайл,Пазар Ежедневно банкиране,False
"възможно ли е да финансираме по облекчената процедура клиент, чиито трудов договор е бил прекратен, но е подал искане за кредитна карта",Пазар Разсрочени плащания,69a5796a-a584-492c-9af9-eacebb89db9b,"ВЪЗМОЖНО ЛИ Е ДА  ФИНАНСИРАМЕ ПО ОБЛЕКЧЕНАТА ПРОЦЕДУРА КЛИЕНТ, ЧИИТО ТРУДОВ ДОГОВОР Е БИЛ ПРЕКРАТЕН, НО Е ПОДАЛ ИСКАНЕ ЗА КРЕДИТНА КАРТА",Пазар Разсрочени плащания,False
възможно ли е в мобилното приложение dsk mobile клиент да се върне стъпка назад при подготовка за превод и да промени някои от параметрите,Пазар Ежедневно банкиране,2e19df45-2160-4382-9ad7-5016bf3b886d,ВЪЗМОЖНО ЛИ Е В МОБИЛНОТО ПРИЛОЖЕНИЕ DSK MOBILE КЛИЕНТ ДА СЕ ВЪРНЕ СТЪПКА НАЗАД ПРИ ПОДГОТОВКА ЗА ПРЕВОД И ДА ПРОМЕНИ НЯКОИ ОТ ПАРАМЕТРИТЕ,Пазар Ежедневно банкиране,False
може ли ипотеката да е за покупка на имот от съпруг на съпруга ?,Пазар Жилищни и ипотечни кредити,6c251659-7265-438f-adba-af5e982c8f5e,Може ли ипотеката да е за покупка на имот от съпруг на съпруга ?,Пазар Жилищни и ипотечни кредити,False
когато включа план за заплата от кога влизат преференциите,Пазар Ежедневно банкиране,32638e78-58bf-4604-bea5-f12b3fd09079,когато включа план за заплата от кога влизат преференциите ,Пазар Ежедневно банкиране,False
кои са необходимите документи при закриване на сметка ?,Пазар Ежедневно банкиране,7771b48e-f3e5-481d-a240-ae948dfd96d1,Кои са необходимите документи при закриване на сметка ?,Пазар Ежедневно банкиране,False
как се преминава от тийн на младежки пакет ?,Пазар Ежедневно банкиране,535256f6-1f59-4453-bda2-61d05de7f760,Как се преминава от тийн на младежки пакет ?,Пазар Ежедневно банкиране,False
какво е основното предимство на държавните на държавните ценни книжа,Пазар Спестяване и инвестиции,ed8c2025-0613-465b-a7ec-46023c9a911f,Какво е основното предимство на държавните на държавните ценни книжа,Пазар Спестяване и инвестиции,False
пише очаквайте скоро,Други,477a10c9-d760-465e-ad19-1be5d0df10e7,пише очаквайте скоро,Други,False
къде се съхрняват документите кредитна защита в досието на кредита или в отделни папки?,Пазар Банково застраховане,e1f80cad-6a8e-42a4-87db-10997cc26f3f,къде се съхрняват документите кредитна защита в досието на кредита или в отделни папки?,Пазар Банково застраховане,False
може ли да се смени пин в dsk mobile,Пазар Ежедневно банкиране,1cf80836-9d02-4243-aef6-ffc967f0e9fa,Може ли да се смени пин в DSK Mobile,Пазар Ежедневно банкиране,False
"може ли клиентка ,която е по майчинсктво да идтегли ктп",Пазар Потребителско кредитиране,652d002d-3d19-45be-8ccb-14da9b9115fd,"МОЖЕ ЛИ КЛИЕНТКА ,КОЯТО Е ПО МАЙЧИНСКТВО ДА ИДТЕГЛИ КТП",Пазар Потребителско кредитиране,False
дължи ли се такса за откриване на сметка дск старт?,Пазар Ежедневно банкиране,59979a2a-6622-4b27-9cc6-ebbdb123b2ce,Дължи ли се такса за откриване на сметка дск старт?,Пазар Ежедневно банкиране,False
"как да убедя клиента, който не желае, да си прехвърли универсалния пенсионен фонд в дск родина?",Пазар Спестяване и инвестиции,6b8b8ccc-f180-468b-b027-a7e7f347fbfe,"Как да убедя клиента, който не желае, да си прехвърли Универсалния пенсионен фонд в ДСК Родина?",Пазар Спестяване и инвестиции,False
при превод към revolut на държава какво да запишем,ДИРЕКЦИЯ БАНКОВИ ОПЕРАЦИИ,ad472991-b5e3-45bf-ad31-fe60536dba4b,при превод към revolut на държава какво да запишем,ДИРЕКЦИЯ БАНКОВИ ОПЕРАЦИИ,False
"мога ли да се обслужвам в офиси частно банкиране , ако нямам личен банкер",Други,9d6d8d69-5d81-4c35-b4f7-58da91b5000e,"мога ли да се обслужвам в офиси частно банкиране , ако нямам личен банкер",Други,False
какъв е минималният остатък по безсрочна сметка стимул плюс,Пазар Ежедневно банкиране,bee6fb27-0bd3-49ae-8575-ef90ccfec946,какъв е минималният остатък по безсрочна сметка стимул плюс,Пазар Ежедневно банкиране,False
такса теглене на гише от еврова сметка пакет премиум план,ДИРЕКЦИЯ БАНКОВИ ОПЕРАЦИИ,fe86c5ed-dd4e-4574-b9ed-5d907b9c8c22,Такса теглене на гише от еврова сметка пакет премиум план,ДИРЕКЦИЯ БАНКОВИ ОПЕРАЦИИ,False
бланка за приложение1-1 финансово споразумение с ббр,Други,1a8d5992-86b4-4aa2-8e03-f0670297c9a9,бланка за приложение1-1 Финансово споразумение с ББР,Други,False
"след сметка макс , в каква сметка се параметризира",Пазар Ежедневно банкиране,0bfef4f7-824f-42eb-88d2-72c46ce64eeb,"след сметка макс , в каква сметка се параметризира ",Пазар Ежедневно банкиране,False
чуждестранен гражданин проявява интерес към кредит в бдск,Няколко пазара,3197a2ad-257a-4a3e-b1fe-84f2022f67b5,Чуждестранен гражданин проявява интерес към кредит в БДСК,Няколко пазара,False
максимално ltv при доходи от чужбина,Пазар Жилищни и ипотечни кредити,f188e2df-8d03-47a7-92bd-83b1029f18d4,максимално ltv при доходи от чужбина,Пазар Жилищни и ипотечни кредити,False
каква е таксата за теглене от гише до 1000 лева,ДИРЕКЦИЯ ПАЗАР АТМ И КАСОВА ДЕЙНОСТ,1a9e4e22-3b6a-416c-9511-8466a171b0d5,каква е таксата за теглене от гише до 1000 лева,ДИРЕКЦИЯ ПАЗАР АТМ И КАСОВА ДЕЙНОСТ,False
кои са зоните в софия,Други,41564597-104c-4c20-aa0b-5d70d001b2c7,кои са зоните в софия,Други,False
как да предложим застраховка спокойствие по дебитна карта,Пазар Банково застраховане,b1f1c269-9881-44ed-ae7c-89d67f0697d5,КАК ДА ПРЕДЛОЖИМ ЗАСТРАХОВКА СПОКОЙСТВИЕ ПО ДЕБИТНА КАРТА,Пазар Банково застраховане,False
нецелеви ипотечен кредит за вътрешно рефинансиране условия,Пазар Жилищни и ипотечни кредити,4d6877a8-e7fa-4934-83b3-c0e042271ff5,нецелеви ипотечен кредит за вътрешно рефинансиране условия,Пазар Жилищни и ипотечни кредити,False
