question_cleaned,department_target,message_uid,question_original,department_original,is_short_question
сигнатура на клон пловдив тракия,Други,80d2b6ca-b7e2-45cf-9268-92618ea294fb,СИГНАТУРА НА КЛОН ПЛОВДИВ ТРАКИЯ,Други,False
може ли гараж да бъде обезпечение по ипотека ?,Пазар Жилищни и ипотечни кредити,d9a09f19-6b15-4b0c-9156-fb83a72cc198,Може ли гараж да бъде обезпечение по ипотека ?,Пазар Жилищни и ипотечни кредити,False
как се открива рс,Пазар Ежедневно банкиране,38996abf-8dfb-4730-a454-edf770e7ec83,КАК СЕ ОТКРИВА РС ,Пазар Ежедневно банкиране,False
"каква е сумата, която служител може да изплати на клиент с наложен запор?",ДИРЕКЦИЯ БАНКОВИ ОПЕРАЦИИ,2ff9fd28-95b9-4d26-8ffd-9f23b6c0baed,"Каква е сумата, която служител може да изплати на клиент с наложен запор?",ДИРЕКЦИЯ БАНКОВИ ОПЕРАЦИИ,False
смяна на парола в електронно банкиране,Пазар Ежедневно банкиране,3da0e448-0676-4393-81a2-851c03e06c0c,СМЯНА НА ПАРОЛА В ЕЛЕКТРОННО БАНКИРАНЕ,Пазар Ежедневно банкиране,False
трябва ли акт за раждане за откриване на сметка тийн,Пазар Ежедневно банкиране,0f5d8b86-846e-4fea-971e-47ab2a802e90,трябва ли акт за раждане за откриване на сметка тийн ,Пазар Ежедневно банкиране,False
"при първото онлайн плащане след това системата ми поиска pin код, но при следващите ми покупки онлайн не получавам изискване за подобна оторизация, а сумата се плаща вендага, след което получавам единствено известие за извършена транзакция. защо? как отново мога да използвам тази опция за сигурност при плащане?",Пазар Ежедневно банкиране,775c1776-6f74-4d57-9443-a14b7e90f511,"При първото онлайн плащане след това системата ми поиска PIN код, но при следващите ми покупки онлайн не получавам изискване за подобна оторизация, а сумата се плаща вендага, след което получавам единствено известие за извършена транзакция. Защо? Как отново мога да използвам тази опция за сигурност при плащане?",Пазар Ежедневно банкиране,False
какъв е срока за свързване с клиента,Други,7898fdf0-1b9b-4887-8671-7bcca4fbf73d,какъв е срока за свързване с клиента ,Други,False
какъв е срока за експресна фирмена карта?,Пазар Малък бизнес,d801f88d-a825-4832-b1d6-25b3ec7c2049,Какъв е срока за експресна фирмена карта?,Пазар Малък бизнес,False
"ако един клиент има dsk mobile, но няма дск директ и му издадем, то с каква парола и потребителско има трябва да се логва в дск директ",Пазар Ежедневно банкиране,5ab75e9a-21a9-445b-8176-6141a96076f6,"ако един клиент има dsk mobile, но няма дск директ и му издадем, то с каква парола и потребителско има трябва да се логва в дск директ",Пазар Ежедневно банкиране,False
преференция от работоздател state,Други,270c0815-e794-48fe-8700-b6c4071f92c6,преференция от работоздател state,Други,False
параметри на кк galacsi,Пазар Разсрочени плащания,45b0f689-67cd-4861-ac4e-21790549d174,ПАРАМЕТРИ НА КК GALACSI,Пазар Разсрочени плащания,False
как да изтегля от сметка със запор,ДИРЕКЦИЯ БАНКОВИ ОПЕРАЦИИ,63dd6cb2-63cb-43cd-824d-7014454cffdb,как да изтегля от сметка със запор,ДИРЕКЦИЯ БАНКОВИ ОПЕРАЦИИ,False
"здравей, при включен план за заплата, а клиентът има издадени две карти към сметката, коя карта включваме в плана или и двете карти могат да се включат?",Пазар Ежедневно банкиране,f5a70999-b6f1-4901-98c4-7a4530dfcac1,"Здравей, при включен план за Заплата, а клиентът има издадени две карти към сметката, коя карта включваме в плана или и двете карти могат да се включат?",Пазар Ежедневно банкиране,False
мога ли да променям падежната дата,Няколко пазара,2aa40584-dd6d-4c68-a8d7-f0dd04dff721,мога ли да променям падежната дата,Няколко пазара,False
имам предвид при предоставен сертификат каква е отстъпката ?,Пазар Жилищни и ипотечни кредити,348260a9-f59f-4d35-b1d8-7b62170e909f,Имам предвид при предоставен сертификат каква е отстъпката ? ,Пазар Жилищни и ипотечни кредити,False
може ли да се открива рс в евро онбординг?,Пазар Ежедневно банкиране,cca6ae27-d23d-4162-8449-903b29bf93a9,Може ли да се открива РС в евро онбординг?,Пазар Ежедневно банкиране,False
какво е кц,Други,f94b256a-f1e9-4f92-9141-1039cce77240,КАКВО Е КЦ,Други,False
какви възможности за финнсиране на има клиент при кандидастване при потребителски кредит с рефинасиране през dsk mobile,Пазар Ежедневно банкиране,7c3ed350-8648-45bd-94da-36a303550167,какви възможности за финнсиране на има клиент при кандидастване при потребителски кредит с рефинасиране през dsk mobile,Пазар Ежедневно банкиране,False
какъв е основният лимит по кредитна карта platinum по облекчената процедура с план премиум,Пазар Разсрочени плащания,f9106119-cff6-4104-881c-f9eba2d37ab0,Какъв е основният лимит по кредитна карта Platinum по облекчената процедура с план Премиум,Пазар Разсрочени плащания,False
има ли такса за откриване на сметка старт,Пазар Ежедневно банкиране,de6850ac-5d5e-4978-a227-62b232b8b873,има ли такса за откриване на сметка старт ,Пазар Ежедневно банкиране,False
каква е разликата между жилищен и ипотечен кредит,Пазар Жилищни и ипотечни кредити,d8668fdf-6d09-4276-8704-cab19631bd06,каква е разликата между жилищен и ипотечен кредит,Пазар Жилищни и ипотечни кредити,False
каква е лихвата за служители по жик,Пазар Жилищни и ипотечни кредити,dd697e35-4085-4984-84b6-5e9dfea685bb,КАКВА Е ЛИХВАТА ЗА СЛУЖИТЕЛИ ПО ЖИК ,Пазар Жилищни и ипотечни кредити,False
какво е изискването за дърг доход,Няколко пазара,af479250-c328-4fbd-8af1-e618107aee08,какво е изискването за дърг доход,Няколко пазара,False
"може ли да се тегли на каса от клиентска сметка дск тийн, ако титулярът е на 17 години?",Пазар Ежедневно банкиране,78d1d4fd-675d-4d2f-9c06-747076cdd761,"Може ли да се тегли на каса от клиентска сметка ДСК Тийн, ако титулярът е на 17 години?",Пазар Ежедневно банкиране,False
съгласие за обработка на личните данни в дск родина,Пазар Спестяване и инвестиции,19184bed-0cca-4f8b-9cd4-7d569726cb95,съгласие за обработка на личните данни в дск родина,Пазар Спестяване и инвестиции,False
а иматели информация за нещо свързано с банката,Други,73151fa9-05a3-4192-807f-375e1a5a4321,А ИМАТЕЛИ ИНФОРМАЦИЯ ЗА НЕЩО СВЪРЗАНО С БАНКАТА,Други,False
с удостоверение за доход до каква сума мога да пусна ктп,Пазар Потребителско кредитиране,8698a6ac-49eb-4887-a1c6-cead7016425d,с удостоверение за доход до каква сума мога да пусна ктп,Пазар Потребителско кредитиране,False
план за еврова сметка,Пазар Ежедневно банкиране,750c7667-496b-4663-887d-ba9d26f40bc6,план за еврова сметка,Пазар Ежедневно банкиране,False
а може ли по-голяма сума?,Други,bb5b041b-9955-42c4-b713-f87304c93925,а може ли по-голяма сума?,Други,False
дай ми линк калкулатор за достатъчносъ,Няколко пазара,fcecdb73-5876-4f98-986f-a568d2352417,дай ми линк калкулатор за достатъчносъ,Няколко пазара,False
сертификата в електронното банкиране има ли срок,Пазар Ежедневно банкиране,67ef62f4-8eb3-42ab-a866-83b113acb397,сертификата в електронното банкиране има ли срок,Пазар Ежедневно банкиране,False
декларация произход,Пазар Ежедневно банкиране,a6475cf8-e36e-4f3e-a80e-7dd93a273a1f,декларация произход,Пазар Ежедневно банкиране,False
как се променя грешен статичен пин създаден в дск директ ако клиента няма дебитна карта,Пазар Ежедневно банкиране,a4d4395e-47f2-4f2b-9819-3607daa7406a,как се променя грешен статичен пин създаден в ДСК Директ ако клиента няма дебитна карта,Пазар Ежедневно банкиране,False
правим ли преводи към беларус,ДИРЕКЦИЯ БАНКОВИ ОПЕРАЦИИ,2230af95-d789-4c58-a1c8-20379c6a42f5,Правим ли преводи към Беларус,ДИРЕКЦИЯ БАНКОВИ ОПЕРАЦИИ,False
каква е таксата за попълване на платежно нареждане,ДИРЕКЦИЯ ПАЗАР АТМ И КАСОВА ДЕЙНОСТ,69d1420b-90bf-4e13-bb6d-9b05cbb96515,каква е таксата за попълване на платежно нареждане,ДИРЕКЦИЯ ПАЗАР АТМ И КАСОВА ДЕЙНОСТ,False
намери ми списък външни посредници на банка дск,Пазар Жилищни и ипотечни кредити,21f7cd3a-ddc8-4312-958d-6166ee81d876,Намери ми списък външни посредници на Банка ДСК,Пазар Жилищни и ипотечни кредити,False
"колеги, моля за съдействие, за следния казус: мартин – дивидент 1319 лева – само той придобива имота – мах вноска 2638 лева ( за ½ и анализ на 30г.) валентина (майка 60г) – дивидент 1319+пенсия 579,21+заплата 1799,89 = 3698,10 лева :2 = 1849,05 ------------------------ общ доход 5017 лева ( 50% = 2508,50 -250 лева кк = 2258,50 вноска по кредит => кредит ? ) силвия ( сестра) – дивидент 1319 лева може ли да ползваме силвия, съдлъжник и дохода й, да ползваме възрастта на двама млади – 30г. и 50% от вноската да бъде до 2638 лева?",Пазар Жилищни и ипотечни кредити,9f3b06cc-51b2-4765-9685-14d056a89fb1,"Колеги, моля за съдействие, за следния казус:

                Мартин – дивидент 1319 лева – само той придобива  имота – мах вноска 2638 лева ( за ½ и анализ на 30г.)

                Валентина (майка 60г) – дивидент 1319+пенсия 579,21+заплата 1799,89 = 3698,10 лева :2 = 1849,05
               ------------------------
                               Общ доход 5017 лева  ( 50% = 2508,50 -250 лева КК = 2258,50 вноска по кредит => кредит ? )

       
                Силвия ( сестра) – дивидент 1319 лева


                Може ли да ползваме Силвия, съдлъжник  и дохода й,   да ползваме възрастта на двама млади – 30г. и 50% от вноската да бъде до 2638 лева? 
",Пазар Жилищни и ипотечни кредити,False
какво покрива застраховка по дебитна карта,Пазар Банково застраховане,261fed70-4c1c-497f-86f8-dcf883a42b13,какво покрива застраховка по дебитна карта,Пазар Банково застраховане,False
ако в los натиснем уведоми клиента при ново предложение какво се случва,Пазар Потребителско кредитиране,a44af046-b1fa-4b53-b9eb-8cf6dd01550c,Ако в LOS натиснем уведоми клиента при ново предложение какво се случва,Пазар Потребителско кредитиране,False
лица под 18г. могат ли да правят онлайн плащания,Пазар Ежедневно банкиране,35f753ef-1447-449a-adec-2abbb442b8be,Лица под 18г. могат ли да правят онлайн плащания,Пазар Ежедневно банкиране,False
банка дск отпуска ли ктп с доход от чужбина,Пазар Потребителско кредитиране,115b2865-3a84-4c51-940b-27add7cdad10,Банка дск отпуска ли ктп с доход от чужбина,Пазар Потребителско кредитиране,False
кредит под наблюдение,Няколко пазара,140750b3-fa43-4766-bcc5-2a16de44cc87,кредит под наблюдение,Няколко пазара,False
сигурен ли си че гаражите са 2 бр,Пазар Жилищни и ипотечни кредити,322f4874-7234-4a52-a238-5c946e157e18,сигурен ли си че гаражите са 2 бр,Пазар Жилищни и ипотечни кредити,False
съдържание на договор за план премиум,Пазар Ежедневно банкиране,7614ef45-7b6d-4eb5-a33f-803ab9483d1b,съдържание на Договор за План премиум,Пазар Ежедневно банкиране,False
може ли да се открие фирчена сметка на фондация,Пазар Малък бизнес,e8d2f88a-c445-4190-bd73-1bc35baef8c7,може ли да се открие фирчена сметка на фондация,Пазар Малък бизнес,False
word debit master card,Пазар Ежедневно банкиране,32c2d23c-58ea-4b17-995d-ab006b773943,word debit master card,Пазар Ежедневно банкиране,False
необходими документи за откриване на фирмена сметка,Пазар Малък бизнес,c49536d2-882d-4153-a394-cc9f4039ee46,необходими документи за откриване на фирмена сметка,Пазар Малък бизнес,False
как се изчислява nps,Други,b184aa34-972e-4cd6-8900-d2c1036d583b,Как се изчислява NPS,Други,False
колко процента финансираме ателие,Пазар Жилищни и ипотечни кредити,162e82c5-d0db-40a1-99b7-b22552d640e8,колко процента финансираме ателие,Пазар Жилищни и ипотечни кредити,False
какви възможности за финансиране има клиент при кандидатстване за потребителски кредит с рефинансиране през dsk mobile,Пазар Потребителско кредитиране,46ec53ba-923a-4b38-9451-cd6e07b269e4,Какви възможности за финансиране има клиент при кандидатстване за потребителски кредит с рефинансиране през DSK Mobile,Пазар Потребителско кредитиране,False
"за какъв максимален размер на ипотечен кредит може да бъде предварително одобрен клиент с нетен месечен доход по трудов договор 1900 лева, няма други кредити.",Пазар Жилищни и ипотечни кредити,1cb11dab-3b48-45b4-a3ba-293f294b8bad,"За какъв максимален размер на ипотечен кредит може да бъде предварително одобрен клиент с нетен месечен доход по трудов договор 1900 лева, няма други кредити.",Пазар Жилищни и ипотечни кредити,False
как клиент може да увеличи лимита си до максималната сума за теглене или плащане през dsk mobile,Пазар Ежедневно банкиране,8fcf587f-fb2b-42a0-b622-1aa96103576d,как клиент може да увеличи лимита си до максималната сума за теглене или плащане през DSK MOBILE,Пазар Ежедневно банкиране,False
бланка искане за оспорване,ДИРЕКЦИЯ БАНКОВИ ОПЕРАЦИИ,f9e244ec-4289-48ff-a775-caeed4b6704e,бланка искане за оспорване,ДИРЕКЦИЯ БАНКОВИ ОПЕРАЦИИ,False
каква е таксата за теглене на каса от сметка на юридическо лице без заявка?,ДИРЕКЦИЯ ПАЗАР АТМ И КАСОВА ДЕЙНОСТ,7b3c8adb-303a-46c4-ab17-b20ea02dd612,Каква е таксата за теглене на каса от сметка на юридическо лице без заявка?,ДИРЕКЦИЯ ПАЗАР АТМ И КАСОВА ДЕЙНОСТ,False
"какъв е максималният размер за потребителски кредит, който може да усвои клиент със заплата 1500 лв. нето?",Пазар Потребителско кредитиране,88607a08-3025-438c-9b0c-b00f6f358ede,"Какъв е максималният размер за потребителски кредит, който може да усвои клиент със заплата 1500 лв. нето?",Пазар Потребителско кредитиране,False
с много неща,Други,71c4fb71-fc80-45c8-a5ec-e5cef358bab1,С МНОГО НЕЩА,Други,False
"може ли през los да се обработват искания за кредити, насочени от външни партньори",Пазар Потребителско кредитиране,490a67b2-a220-4831-a415-1a3d08328628,"Може ли през LOS  да се обработват искания за кредити, насочени от външни партньори",Пазар Потребителско кредитиране,False
премиум пла,Други,d4e21d57-bef1-486c-81a6-095055292a6d,премиум пла ,Други,False
може ли клиент да използва дск смарт на два телефона,Пазар Ежедневно банкиране,e91d856f-2aa8-452e-b31e-47596029aa74,може ли клиент да използва дск смарт на два телефона,Пазар Ежедневно банкиране,False
кога мога да си изтегля паричните средства от универсален пенсионен фонд дск родина?,Пазар Спестяване и инвестиции,b92d7707-7242-47f2-85bd-2aabf24786a0,Кога мога да си изтегля паричните средства от универсален пенсионен фонд ДСК Родина?,Пазар Спестяване и инвестиции,False
какво включва асистиран онлайн процес в офис на банката за регистрация на бизнес клиенти?,Пазар Малък бизнес,e2e6dbb8-b409-4fcd-88eb-45c4ff2cce59,Какво включва Асистиран онлайн процес в офис на Банката за регистрация на бизнес клиенти? ,Пазар Малък бизнес,False
м токен изписва очаква активация,Пазар Ежедневно банкиране,8002d14e-180d-49f1-a1fc-71ce50dff581,м токен изписва очаква активация,Пазар Ежедневно банкиране,False
каква е максималната възраст за кандидатстване за кредит за текущо потребление от клиенти пенсионери?,Пазар Потребителско кредитиране,13599c6b-6581-4b3b-9168-4837d2ccb144,Каква е максималната възраст за кандидатстване за кредит за текущо потребление от клиенти пенсионери?,Пазар Потребителско кредитиране,False
може ли линк за дигитален онбординг за набурателна сметка,Пазар Малък бизнес,13187464-7a85-459e-8a37-baa027eef449,може ли линк за дигитален онбординг за набурателна сметка,Пазар Малък бизнес,False
предлагат ли се срочни депозити,Пазар Ежедневно банкиране,c0bb1261-319f-49fc-9dcd-67272f1eb343,предлагат ли се срочни депозити,Пазар Ежедневно банкиране,False
при жилищните кредити има ли промяна в продуктовите карти,Пазар Жилищни и ипотечни кредити,941d195d-5b48-4040-852c-7658406f45c9,При жилищните кредити има ли промяна в продуктовите карти,Пазар Жилищни и ипотечни кредити,False
за правно и юридическо становище,Пазар Жилищни и ипотечни кредити,0227b5f0-c48a-4fbc-9863-f00439cd3ab3,за правно и юридическо становище,Пазар Жилищни и ипотечни кредити,False
има ли такса при ченч,ДИРЕКЦИЯ ПАЗАР АТМ И КАСОВА ДЕЙНОСТ,47f7025a-b625-4667-b523-b3c4c9ce6772,Има ли такса при ченч,ДИРЕКЦИЯ ПАЗАР АТМ И КАСОВА ДЕЙНОСТ,False
може ли да се открива рс на вече регистриран клиент през дск мобайл?,Пазар Ежедневно банкиране,4d0361ae-e65f-48d0-9c22-972b2ab51538,Може ли да се открива РС на вече регистриран клиент през ДСК Мобайл?,Пазар Ежедневно банкиране,False
