question_cleaned,department_target,message_uid,question_original,department_original,is_short_question
необходимо ли е да се носи акт за раждане при откриване на рс дск тийн ?,Пазар Ежедневно банкиране,a30c8953-ed4b-410f-a851-9746be8de182,Необходимо ли е да се носи акт за раждане при откриване на РС ДСК ТИЙН ?,Пазар Ежедневно банкиране,False
visa credit,Пазар Разсрочени плащания,799c6054-f2f6-4206-9486-552573d51104,visa credit,Пазар Разсрочени плащания,False
браво страхотен си,Други,4f4fadaf-a968-4ae5-9f40-fbe76dde51a5,Браво страхотен си,Други,False
колко е таксата за преиздаване на кредитна карта?,ДИРЕКЦИЯ БАНКОВИ ОПЕРАЦИИ,e3d065d4-7e05-4403-8c9f-81969b87fcf1,Колко е таксата за преиздаване на кредитна карта?,ДИРЕКЦИЯ БАНКОВИ ОПЕРАЦИИ,False
има ли обекчена процедура за издаване на кредитни карти на чужденци,Пазар Разсрочени плащания,75a5a770-fc54-46ba-b699-e6b1757d2656,Има ли обекчена процедура за издаване на кредитни карти на чужденци ,Пазар Разсрочени плащания,False
условия по план премиум,Пазар Ежедневно банкиране,fc170111-0caa-454d-98ed-8044a6542147,условия по план премиум,Пазар Ежедневно банкиране,False
ако клиента е завил пари за теглене на каса и не ги вземе какви са последиците,ДИРЕКЦИЯ ПАЗАР АТМ И КАСОВА ДЕЙНОСТ,185d442d-4dce-4379-9e98-8d4009e3d10a,ако клиента е завил пари за теглене на каса и не ги вземе какви са последиците ,ДИРЕКЦИЯ ПАЗАР АТМ И КАСОВА ДЕЙНОСТ,False
какво е несеквестеруема сума,Support_Services,686c41a6-2ef7-45ba-8c46-c151d55064f2,какво е несеквестеруема сума,ПРАВНО,False
как се закрива дтеска сметка тийн при пълнолетен ?,Пазар Ежедневно банкиране,f563fa89-3ca9-4335-8037-489b9fd7af41,Как се закрива дтеска сметка тийн при пълнолетен ?,Пазар Ежедневно банкиране,False
ако съм има просрочие в 2023г. но кредита е погасен проблем ли е?,Пазар Потребителско кредитиране,39579a2c-786a-4a94-875e-5684bbd7c37a,Ако съм има просрочие в 2023г. но кредита е погасен проблем ли е?,Пазар Потребителско кредитиране,False
условия за жик при акт 15?,Пазар Спестяване и инвестиции,dff83ed0-7ebd-4eda-a910-028b73ac93ab,Условия за ЖИК при акт 15?,Пазар Спестяване и инвестиции,False
каква е таксата за мултикеш на бюджет,Пазар Малък бизнес,c0ca2127-b02a-4fae-8128-5858a4774720,Каква е таксата за Мултикеш на бюджет,Пазар Малък бизнес,False
такса за банкова референция за погасен кредит,Пазар Ежедневно банкиране,7aac8c7d-71c5-4588-89c5-61a404f7f4c6,такса за банкова референция за погасен кредит,Пазар Ежедневно банкиране,False
"каква е таксата за сепа превод, нареден от фирма",ДИРЕКЦИЯ БАНКОВИ ОПЕРАЦИИ,09e9a4f4-5f80-433f-89c2-0e788b22d68d,"каква е таксата за сепа превод, нареден от фирма",ДИРЕКЦИЯ БАНКОВИ ОПЕРАЦИИ,False
какво е възрастовото ограничение на кредитоискател за ктп,Пазар Потребителско кредитиране,999ce8c5-a1a6-467b-9a1f-ac613095a2ec,какво е възрастовото ограничение на кредитоискател за КТП,Пазар Потребителско кредитиране,False
може ли да има съдлъжник през los,Пазар Потребителско кредитиране,ec978ab6-b509-4ae5-99d5-eccf72eada2b,може ли да има съдлъжник през LOS,Пазар Потребителско кредитиране,False
колко време назад може да се извади авизо за превод,ДИРЕКЦИЯ БАНКОВИ ОПЕРАЦИИ,ad1fc26c-501c-44e6-bce4-b24999179faf,колко време назад може да се извади авизо за превод,ДИРЕКЦИЯ БАНКОВИ ОПЕРАЦИИ,False
как да продам смисъл за теб,Пазар Спестяване и инвестиции,2658cf32-d693-4149-8ff4-18f335db6da5,как да продам смисъл за теб,Пазар Спестяване и инвестиции,False
какво е мнението ти за уникредит булбанк,Други,768aae12-41ed-470c-ae6a-bb82fce46f25,какво е мнението ти за Уникредит булбанк,Други,False
"служителят излъчил преовда е сгрешил , ане клиента",Други,78a0c59b-7cec-4875-b7bc-826b28dfcfe8,"СЛУЖИТЕЛЯТ ИЗЛЪЧИЛ ПРЕОВДА Е СГРЕШИЛ , АНЕ КЛИЕНТА",Други,False
може ли да дадем допълнителни средства при жилищни кредити на етапи,Пазар Жилищни и ипотечни кредити,19a8e99f-9091-447f-b96c-6fc7dcf62825,Може ли да дадем допълнителни средства при жилищни кредити на етапи,Пазар Жилищни и ипотечни кредити,False
как да слеем два акаунта с един,Други,e1eab73d-4c4d-42be-8f53-3ef3638955cb,Как да слеем два акаунта с един ,Други,False
"мога ли да кандидатствам за кредит, ако имам просрочие през 2024г. в цкр",ДИРЕКЦИЯ КРЕДИТЕН РИСК ИНДИВИДУАЛНИ КЛИЕНТИ,64aeed68-feb2-4149-858e-3d7452386640,"Мога ли да кандидатствам за кредит, ако имам просрочие през 2024г. в ЦКР",ДИРЕКЦИЯ КРЕДИТЕН РИСК ИНДИВИДУАЛНИ КЛИЕНТИ,False
до каква сума клиент може да нареди превод през дск смарт,Пазар Ежедневно банкиране,0379cd5a-a73b-45dd-8bb9-5a7990902e7c,До каква сума клиент може да нареди превод през ДСК смарт,Пазар Ежедневно банкиране,False
от къде получи тази информация,Други,52e2f3f0-7e17-4ba8-9e0d-d9c51b268475,от къде получи тази информация ,Други,False
каква е цената на един sms,Други,4c43ffdc-ccf5-45a4-9b83-843c4cf4cf98,каква е цената на един SMS,Други,False
преди думата трябва има ли запетая ?,Други,071bb3d3-30f3-4431-9663-c3a31330cff6,Преди думата трябва има ли запетая ?,Други,False
колко минути е обедната почивка,Други,79891ab6-acdf-4ca5-a49d-2c4633685e01,Колко минути е обедната почивка ,Други,False
предлагаме ли кредит за погасяване на задължения към топлофикация при запор,Пазар Потребителско кредитиране,a4c5a17e-b6e3-43f6-b7e4-951eb2c3fa10,предлагаме ли кредит за погасяване на задължения към топлофикация при запор,Пазар Потребителско кредитиране,False
само родител без да присъства детето може ли да открие и получи банковата му карта?,Пазар Ежедневно банкиране,ac4aa538-5457-43e1-a203-3152d830f09d,Само родител без да присъства детето може ли да открие и получи банковата му карта?,Пазар Ежедневно банкиране,False
опис на досие на юл,Пазар Малък бизнес,7e2ab176-2965-4dd1-ac2a-24916c0d627e,опис на досие на Юл,Пазар Малък бизнес,False
има ли такса при вноска на дск старт,Пазар Ежедневно банкиране,f1b27666-ce12-4240-8ea1-e33a17215c7b,има ли такса при вноска на дск старт,Пазар Ежедневно банкиране,False
дължи ли се такса вноска по детски спестовен влог от трето лице,Пазар Ежедневно банкиране,5a4fec18-48f3-4d78-b75e-a7dc876a0bc8,дължи ли се такса вноска по детски спестовен влог от трето лице,Пазар Ежедневно банкиране,False
кои параметри може да се променят по офертата за потребителски кредит в приложението dsk mobile,Пазар Потребителско кредитиране,9afc8eb0-c212-48e0-ad97-b46043e4e1a4,кои параметри може да се променят по офертата за потребителски кредит в приложението dsk mobile,Пазар Потребителско кредитиране,False
"при рефинансиране на ипотечен кредит от друга банка комбинирано с рефинансиране на потребителски в банка дск ад, банкат ще възстанови ли разходите за ипотеката на клиента",Пазар Жилищни и ипотечни кредити,af1a7f45-f0d8-4790-be2e-9e6860b95083,"При рефинансиране на ипотечен кредит от друга банка комбинирано с рефинансиране на потребителски в Банка ДСК АД, Банкат ще възстанови ли разходите за ипотеката на клиента",Пазар Жилищни и ипотечни кредити,False
може ли дете на 14 години да си вземе самостоятелно дебитната карта,Пазар Ежедневно банкиране,0880b1fc-28d8-4cb7-b212-64e28a1a41b5,може ли дете на 14 години да си вземе самостоятелно дебитната карта,Пазар Ежедневно банкиране,False
"по застраховка ""любим дом стандарт"" застраховат ли се соларни панели на покрив?",Пазар Банково застраховане,4b0df537-b293-4642-bd0c-778e54bfc18d,"По застраховка ""Любим дом Стандарт"" застраховат ли се соларни панели на покрив?",Пазар Банково застраховане,False
необходимо ли е потвърждение с пин или биометрия за заплащане на битови сметки през dsk mobile,Пазар Ежедневно банкиране,10b568e2-706e-479f-accd-f60d7d147ac2,необходимо ли е потвърждение с ПИН или биометрия за заплащане на битови сметки през DSK Mobile,Пазар Ежедневно банкиране,False
ще искаме ли съдлъжник с адресна регистрация в българия на гражданин на беларус с постоянно пребиваване в българия,Пазар Жилищни и ипотечни кредити,ecc1e823-9692-4898-ac73-54e3aa3fe126,ще искаме ли съдлъжник с адресна регистрация в българия на гражданин на Беларус с постоянно пребиваване в българия,Пазар Жилищни и ипотечни кредити,False
как сконтираме вноска ако клиента влезе в пенсионна възраст,Пазар Жилищни и ипотечни кредити,8b153296-b193-49a1-95fb-b3a79e37ce25,Как сконтираме вноска ако клиента влезе в пенсионна възраст,Пазар Жилищни и ипотечни кредити,False
задължително ли е включване на план за ежедневно банкиране,Пазар Ежедневно банкиране,17283d0c-70f3-4704-aca1-d52cbfca2447,задължително ли е включване на план за ежедневно банкиране,Пазар Ежедневно банкиране,False
каква е разликата между план премиум и пакет премиум,Пазар Ежедневно банкиране,a40a9751-cbd4-431b-943c-ba94a6588533,каква е разликата между план премиум и пакет премиум,Пазар Ежедневно банкиране,False
аромати дрогерие,Други,53fa5eff-8204-4577-a810-c8209353f474,аромати дрогерие ,Други,False
може ли клиент с доходи от майчинствто да кандидатства за кредит,Пазар Потребителско кредитиране,c188a840-e550-45a6-ac50-500128fe3430,може ли клиент с доходи от майчинствто да кандидатства за кредит,Пазар Потребителско кредитиране,False
теглене на сума от сметка на клиент под запрещение,Support_Services,39a92518-cda7-425b-b23d-60e62312e4aa,ТЕГЛЕНЕ НА СУМА ОТ СМЕТКА НА КЛИЕНТ ПОД ЗАПРЕЩЕНИЕ,ПРАВНО,False
усковия за набирателна сметка онлайн,Пазар Малък бизнес,537ff6ef-c635-448c-a265-56c584dc97f0,Усковия за набирателна сметка онлайн,Пазар Малък бизнес,False
а получаването,Други,abf6308a-9246-438d-95e4-b0b829197e21,а получаването,Други,False
за да се изтрие сметка как се маха план,Пазар Ежедневно банкиране,c24fd8fd-35ef-41ee-8ac3-38a872119263,за да се изтрие сметка как се маха план,Пазар Ежедневно банкиране,False
можем ли да дадем ктп в размер на 95000лв.,Пазар Потребителско кредитиране,0bdbf240-2392-4a97-9f88-5bbeffc5bab6,Можем ли да дадем КТП в размер на 95000лв.,Пазар Потребителско кредитиране,False
"има ли гратисен период за плащане на поредни вноски по застраховки ""спокойствие"" към дебитна карта, кредитна карта и овърдрафт?",Пазар Банково застраховане,0b14c84c-66bc-4ebf-8038-dd32dfaf8e6c,"Има ли гратисен период за плащане на поредни вноски по застраховки ""СПОКОЙСТВИЕ"" към Дебитна карта, Кредитна карта и Овърдрафт?",Пазар Банково застраховане,False
дължат ли такси по ипотечни кредити служители на дъщерните дружества на банка дск ?,Пазар Жилищни и ипотечни кредити,69fcbc9e-4d93-4ba3-a57b-26b5715d2c02,Дължат ли такси по ипотечни кредити служители на дъщерните дружества на Банка ДСК ?,Пазар Жилищни и ипотечни кредити,False
"когато има съдебно изискуем кредит, към кого трябва да се обърнем?",Support_Services,ce95fa67-8c6b-4100-8029-4cf4aec6c3e6,"Когато има съдебно изискуем кредит, към кого трябва да се обърнем?",ПРАВНО,False
"след колко неплатени такси се прекратява план премиум : 1, 2 или 3",Пазар Ежедневно банкиране,6d0355ad-0718-4a9c-af8e-c303ec39477b,"след колко неплатени такси се прекратява план премиум : 1, 2 или 3",Пазар Ежедневно банкиране,False
каква е минималната сума за срочен депозит?,Пазар Ежедневно банкиране,49f574d1-cae2-4e9d-bc7a-a4d4b8b925b7,Каква е минималната сума за срочен депозит?,Пазар Ежедневно банкиране,False
"може ли клиент да получава sms-и, които не отговарят на реалната сума, която остава по сметката? към кой да се обърна?",Други,6482a272-bfab-447d-aaac-650f487c4d78,"МОЖЕ ЛИ КЛИЕНТ ДА ПОЛУЧАВА SMS-И, КОИТО НЕ ОТГОВАРЯТ НА РЕАЛНАТА СУМА, КОЯТО ОСТАВА ПО СМЕТКАТА? КЪМ КОЙ ДА СЕ ОБЪРНА?",Други,False
здравейте искам да попитам има ли опция да се изтрият движенията по моята сметка ? изобщо да не съществуват ? благодаря .,Пазар Ежедневно банкиране,bc4c1226-758c-4034-85d6-af0eadc49804,"Здравейте искам да попитам има ли опция да се изтрият движенията по моята сметка ? Изобщо да не съществуват ?
Благодаря .",Пазар Ежедневно банкиране,False
такси план без ограничение,Пазар Ежедневно банкиране,369bbbf6-beb7-4504-8d50-5139d6136b7d,такси план без ограничение,Пазар Ежедневно банкиране,False
допуска ли се онбординг за регистрация на дружество с трима собственици с по 33% участие в капитала,Пазар Малък бизнес,6473a19a-27e2-45b7-b2d0-aa24809e17c7,Допуска ли се онбординг за регистрация на дружество с трима собственици с по 33% участие в капитала,Пазар Малък бизнес,False
може ли клиент да си открие сметка в австралийски долари в клон на банката,Пазар Ежедневно банкиране,8c79230c-29cc-4e30-b0a9-ae50d0e894db,Може ли клиент да си открие сметка в Австралийски долари в клон на банката,Пазар Ежедневно банкиране,False
кредитна защита,Пазар Банково застраховане,5e17913b-13a7-4de6-889a-17929075f1ea,кредитна защита,Пазар Банково застраховане,False
получавам заплата 4000лв с променлив лихвен процент и равни месечни вноски,Други,dae2f266-75e2-4cac-8740-376425fb7ea4,получавам заплата 4000лв с променлив лихвен процент и равни месечни вноски,Други,False
"здравейте, може ли да бъде закрит спестовен влог дск бъдеще на непълнолетен 14г. и да бъде прехвърлена сумата по разпл. сметка дск тийн",Пазар Ежедневно банкиране,f79a32f3-e16a-473c-9619-e8c795900049,"Здравейте, може ли да бъде закрит спестовен влог дск бъдеще на непълнолетен 14г. и да бъде прехвърлена сумата по разпл. сметка дск тийн",Пазар Ежедневно банкиране,False
тристранно споразумение за електронни канали,Пазар Малък бизнес,6d943775-a5ae-403c-9d89-8db33f3fd9ff,тристранно споразумение за електронни канали,Пазар Малък бизнес,False
колко обратни връзки трябва да имаме за да подържаме nps на 90%,Други,c41c4b83-9db1-485e-b973-b1ab58656fa7,колко обратни връзки трябва да имаме за да подържаме nps на 90%,Други,False
извлечения по сметки на визически лица,Пазар Ежедневно банкиране,a397c1bf-565a-4124-9994-9a8c4c2ad403,извлечения по сметки на визически лица,Пазар Ежедневно банкиране,False
харесваш ли ме,Други,ff4216fe-7612-411c-8343-3c9aa6c004a8,харесваш ли ме,Други,False
клиент има нужда от съдействие за своята isic карта и стикера за бдж. как можем да му съдействаме?,Пазар Ежедневно банкиране,779687c2-8e70-4e29-b74f-8d2ab48d2383,Клиент има нужда от съдействие за своята ISIC карта и стикера за БДЖ. Как можем да му съдействаме?,Пазар Ежедневно банкиране,False
такса за справка на бизнес клиент по разплащателна сметка,Пазар Малък бизнес,a9309154-c252-4ad5-ab67-3d652c827a1a,такса за справка на бизнес клиент по разплащателна сметка,Пазар Малък бизнес,False
3568+3568,Други,a9b40a9a-c3f4-4193-8b07-e7b4d79ca1af,3568+3568,Други,True
"този отговор не отговаря конкретно на въпроса , които зададох и ми го отговаряш за 2ри път не ми става ясно какео отговаряш",Други,4caaa448-2447-4ca9-8df6-0de49d181a29,"този отговор не отговаря конкретно на въпроса , които зададох и ми го отговаряш за 2ри път не ми става ясно какео отговаряш",Други,False
кредитна карта може ли да се дигитализира в дск мобайл,Пазар Ежедневно банкиране,2fb6b39b-9359-4cd5-af12-898c074a4619,Кредитна карта може ли да се дигитализира в ДСК Мобайл,Пазар Ежедневно банкиране,False
къде се качват сканираните нареждания за отказ от еднократни/периодични преводи с бъдеща дата на изпълнение?,ДИРЕКЦИЯ ПАЗАР АТМ И КАСОВА ДЕЙНОСТ,42290e59-6170-4176-bcc0-03040b6ef326,къде се качват сканираните нареждания за отказ от еднократни/периодични преводи с бъдеща дата на изпълнение?,ДИРЕКЦИЯ ПАЗАР АТМ И КАСОВА ДЕЙНОСТ,False
какво може да загуби инвеститорът при инвестиция в договорен фонд?,Пазар Спестяване и инвестиции,d66206d2-05b4-4b8b-959e-9b3486e75d87,Какво може да загуби инвеститорът при инвестиция в договорен фонд?,Пазар Спестяване и инвестиции,False
:),Други,b9b96457-03fb-4150-9903-bcb72a082966,:),Други,True
кога стартира поетапното преминаване към visa карти,Пазар Ежедневно банкиране,922cbbc4-addd-418a-afb8-02e33e8d589e,Кога стартира поетапното преминаване към Visa карти,Пазар Ежедневно банкиране,False
местоположение на банкомати за внасяне на пари,ДИРЕКЦИЯ ПАЗАР АТМ И КАСОВА ДЕЙНОСТ,fd984530-e19c-4047-b992-8619bae4c358,местоположение на банкомати за внасяне на пари ,ДИРЕКЦИЯ ПАЗАР АТМ И КАСОВА ДЕЙНОСТ,False
